{"cleanupAttempts":3,"cpu":4,"createTimeoutSeconds":600,"deleteTimeoutSeconds":120,"diskGiB":10,"ephemeral":true,"executionTimeoutSeconds":9000,"gpu":1,"gpuTypes":["RTX-PRO-6000","H100"],"image":"docker.io/pytorch/pytorch@sha256:417bd75df6365104c283ea4c1651fb3530d9eb5a4c2fafa51943cff2a94e6385","memoryGiB":8,"networkBlockAll":true,"public":false,"schemaVersion":1,"sdkVersion":"0.207.0","spot":false,"target":"us","transferTimeoutSeconds":1800,"ttlMinutes":180}
